-1|0|0|doc47534-2-2|家里有辆宝莱1.6,我和家人是大众的拥簇。
-1|0|0|doc10790-5-1|d级豪华车：奔驰s。
-1|0|0|doc10790-5-2|suv方面，宝马赢中小尺寸；
-1|0|0|doc47598-1|我家孩子很喜欢车,前几天还告诉我和老公,奥迪车挺好,或者咱家买宝马吧,让人很是诧异
-1|0|0|doc47644-2|收藏一个相比于宝马,我跟喜欢奥迪这种稳重低调的霸气
-1|0|0|doc47744-2|s:我是奥迪控,虽然有朋友和我说奥迪没有宝马好,但我只终于我的喜欢的;
-1|0|0|doc47719-1|青春财富中心门口真是名车展啊,宝马、奥迪、凯迪拉克等等,不过还是那两辆加长版的悍马最霸气!!!
-1|0|0|doc47762-2|但是考虑到,现在宝马、奔驰,都破20万了,买个奢华品牌也物有所值啊。
-1|0|0|doc27372-1-1|一辆紧凑型的宝马3系能卖30万
-1|0|0|doc47521-1|呀,果然是我喜欢的奥迪,嘿嘿~~~我最喜欢的车车就是奥迪和mini了保时捷诶
-1|0|0|doc47091-2|只不过我喜欢金色,那两辆奥迪q7还是进的那辆更好看,奔驰
-1|0|0|doc47518-2|大车就牧马人或者奔驰g55,虽然目标够远的
-1|0|0|doc47896-1-1|奔驰宝马增速放缓却依然是其全球销售重心
-1|0|0|doc47896-1-2|奥迪强悍依然
-1|0|0|doc30614-1-1|他说：“本田cr-v，正是以城市风格suv，满足了人们对自由、宽广生活的梦想，从而成功激活了城市suv这一细分市场
-1|0|0|doc33082-2|这可是在神州大地头回享受如此待遇,虽然俺的车一直没任何毛病,可这样的厂家多温暖人心啊.
-1|0|0|doc47545-2|大家一起为tt努力,不过真的到买tt那时候,我会选择买大黄蜂…
-1|0|0|doc47714-1-1|真的霸气不过我还是喜欢奥迪哈哈
-1|0|0|doc47714-1-2|这部科迈罗比大黄蜂还要霸气啊!
-1|0|0|doc47137-1|对了,他还能通过车标识别说出大众、奥迪、别克、奔驰、马自达、阿哟塔(丰田),最喜欢的车是宝马
-1|0|0|doc47647-1|你先送我个迪奥我再考虑一下~看看人家奥迪汽车广告做的,求送audio霸气外露
-1|0|0|doc47879-1|全新奥迪mpv的设计理念将与在欧洲热卖的福特s-max相近,在提供不俗的实用性之外,还拥有良好的性能和操控乐趣
-1|0|0|doc47249-1-1|我这人一直对汽车一点兴趣都没有(除了车震倒是兴趣浓厚)但凯迪拉克一直是我最喜欢的品牌,因为我小时候爱听的那些punk乐队后来出名赚到钱了都买的凯迪
-1|0|0|doc47249-1-2|买奥迪便宜性价比相对前者比较高,,妈逼纠结了,ihatecarssomuch,,goddamnit
-1|0|0|doc46617-2-1|我喜欢法拉利
-1|0|0|doc47511-1|看完兰博基尼的报价,我发现,算了,保时捷就好了,其实奥迪r8真的挺不错,未来,为之奋斗!
-1|0|0|doc47825-2-1|进去就要涂防晕车的油,这次乘上朗逸,事情啊没有,油也不用涂,坐的挺舒坦,在车里发短信也不晕车
-1|0|0|doc47825-2-2|看来最高只能接受奥迪a6这样的坐的也还行,不是很晕!
-1|0|0|doc47549-5|车友问答#亲,大众cc是一款性能不错的车,压扁了拉长了就是一款迈腾,外形时尚,无框车窗看上去很帅气!
-1|0|0|doc46750-2|一直很喜欢亚光黑色,经典超质感、耐看不庸俗,接下来还有锐志、mini、bmwx5
-1|0|0|doc46275-2-1|哥喜欢的是奥迪跟奔驰~
-1|0|0|doc47142-2|英菲尼迪和马自达貌似最霸气肿么没有奥迪的啦!
-1|0|0|doc47105-1|这款s-line版本除了s-line油门踏板、s-line三幅方向盘外,最显眼的还是双七辐的20英寸s-line轮毂,在q5身上显得十分霸气。
-1|0|0|doc25889-1-1|换车啦，换车啦~我中意本田crv白色既
-1|0|0|doc25889-1-2|或者我只dreamcar飞度黄色既。
-1|0|0|doc47725-1|奥迪a4allroadquattro#搭载的7速stronic双离合变速箱换挡异常平顺,整个过程仅需百分之几秒!
-1|0|0|doc48333-2|名车鉴赏#作为奥迪家族中的一个全新系列,a5将奥迪一惯推崇的充满动感的设计、激动人心的动力与操控性能、卓越的制造工艺完美结合
-1|0|0|doc47608-1|这段时间儿子开始认车的牌子,狂喜欢奥迪车
-1|0|0|doc47891-3|奥迪q5的车身设计充分考虑越野驾驶需求,拥有同级别最优秀的接近角(25度)和最佳的涉水深度(500毫米)
-1|0|0|doc44936-1|看汽车各种独立悬挂,对性能的影响,越来越喜欢运动型底盘,车身稳定性是必须的,但操控性和乘坐舒适性,更在意操控,所以才会爱宝马不喜奥迪,什么时候能买一辆。。
-1|0|0|doc48500-1|作为目前市场上运动性能最强的混合动力suv,在纯电动模式下,奥迪q5hybridquattro最高车速可达100公里/小时。
-1|0|0|doc47683-1|日内瓦车展##新车发布#a3轿车概念车霸气的前脸设计,继承奥迪新家族大灯的风格,霸气的进气隔,气势的中网,绝对是一款冲击你视觉的设计。
-1|0|0|doc47867-3|前脸的水平线条、略向外移的大灯中心点、及较低的整流板设计,全部凸显了全新奥迪a8的宽阔与豪气。
-1|0|0|doc45545-1|今儿看了奥迪a8l新款的发布会,真是聚拢好多权贵公众人物前去助阵,更能体现该款车的定价以及其价值,很喜欢它的银色车身搭配黑色的顶篷,赞一下。
-1|0|0|doc45215-2|德国车精致典雅,设计出色,动力舒适兼具,代表了一种严谨细致,踏实奋斗,理性追求卓越的性格
-1|0|0|doc48527-3|奥迪a4l是一款运动感很强的车,外观也很时尚,适合中、青年人群,装备有2.0t发动机的动力性就不用说了,0-100公里\\小时提速时间不足8秒,让人感觉不错;
-1|0|0|doc47906-1|nissan的vq发动机,连续14年荣获“世界十佳发动机”称号,与奥迪、宝马的发动机齐名。
-1|0|0|doc48396-1|5.2升v10发动机拥有386千瓦的输出功率和530牛米的峰值扭矩,仅约4秒的百公里加速时间可比肩经典的法拉利f430,近250万人民币的售价也代表着其“超级跑车”的非凡身份,使其成为无数赛车爱好者的“梦想之车”。
-1|0|0|doc46618-1|4门轿车将双门轿跑车的经典比例,具有感染力的外表以及豪华轿车的舒适以及功能性完美的结全在一起
-1|0|0|doc48350-1|内饰方面,空间将在a6之上a8车型之下,但豪华程度将于a8车型看齐
-1|0|0|doc47550-1|口水ing红色的奥迪a3,霸气的前脸,流线造型,新一代a3太炫了!
-1|0|0|doc48301-1|拥有无比迷人的驾控感,在奥迪品牌的运动车型中堪称翘楚
-1|0|0|doc47641-1|而且进口q3这个价,等明年国产了,估计就可以上4s店哄抢了,确实这牌子这质量这价格,无敌啊!
-1|0|0|doc14938-2|#我最喜爱的广本车#最爱歌诗图2.4l,不止有雅阁的舒适也带有suv的空间，采用的是2.4发动机同为本田k24动力和油耗口碑都非常不错，为了适应块头更大的歌诗图，功率调校比雅阁和cr-v都高，达到144kw（192马力）最大扭矩为222nm。
-1|0|0|doc48046-1|在报告中,北京现代在车主对于新车购买体验满意度调查中表现出色,获得了891分的高分,并与奥迪(898分)和东风日产(897分)一起位列前三甲,显示了广大消费者对北京现代品牌的高度认可
-1|0|0|doc47610-1|奥迪tt就是这么一款形象靓丽、性能不俗的跑车,一起欣赏#奥迪tt#的视频吧
-1|0|0|doc47320-2|看到a1将全面推行时尚个性定制很兴奋,就他了~就他了“在配置上,奥迪a1配备了包括发动机自动启停系统、全景天窗等
-1|0|0|doc48359-1|唯有卡宴,兼具霸气的外观与德系的品质,非常赞!
-1|0|0|doc47690-1|看到这张照片,开始喜欢黑色的奥迪了~进取先锋佳人香车,感觉奥迪a8与高圆圆的气场很match呀
-1|0|0|doc47887-1|精雕细琢每一方寸#全新一代奥迪a6l的全led前大灯与整个车身设计浑然一体,光芒璀璨入目
-1|0|0|doc48304-2|rt:宣布#精彩车图#奥迪audia5coupe2012款亮相,前脸设计变化最大,采用了新奥迪a6风格的前大灯,线条更加犀利
-1|0|0|doc48282-1|全新速腾不错,你可以考虑,特别是前后灯的改变更具奥迪特色
-1|0|0|doc47219-2|#奥迪a1#车内的设计是科技与艺术的结晶,仪表板流畅线条的设计灵感源自飞机机翼,圆形空调出风口则是受到飞机引擎的启发
-1|0|0|doc46384-1-1|最近喜欢x1难,宝马这几年所有的活动都围绕用户群和产品展开
-1|0|0|doc47202-1|确实暂时近期没有购买计划,但是我俩都喜欢白色的a4l,想好好看看,方便就试驾一下
-1|0|0|doc48355-2|murano楼兰通过打造豪华静谧的舒适空间,进一步将豪华跑车型suv的舒适性发挥到了极致
-1|0|0|doc48192-2|充分体验了q7的越野性能,体现tdi发动机在低转速的强劲扭矩输出及空气悬挂通过特殊路面时的舒适性
-1|0|0|doc48566-1|近几年,兼具轿车舒适性和优异运动性能的suv车型,可算是鱼与熊掌兼得,备受热捧
-1|0|0|doc48113-2|昨天有幸在顺德立交乘车体验百万级的奔驰和奥迪商务车,奥迪的瞬间加速到160的动力和瞬间制动及机灵活的换道,及凝重的内饰,留下了让人印象深刻运动感
-1|0|0|74371-184640|红色r8最2011年#日内瓦车展#777马力,888牛米的扭矩,最高速度每小时217英里,这就是在亮相车展上的#奥迪r85.2#,大气的红色更添霸气。
-1|0|0|doc47996-1|abtr8采用了碳纤维材质,从而减轻了整车的重量,同时也提升了其动力性能。
-1|0|0|doc47319-2|在泉州的奥迪展厅已经见过了这款,和竞争对手mini相比,a1的外观更具运动感,外观更能让大众接受
-1|0|0|doc46343-2|全新奥迪a6l#外观新奥迪a6最让人印象深刻的就是颠覆性设计的前大灯,可选配的全led大灯组科技感极强,一下子就和老款a6区别开来
-1|0|0|doc48286-1|五美索纳塔“流体雕塑”外观设计、智能且丰富的配置、豪华舒适的驾乘感受,堪称同级“车中翘楚”。
-1|0|0|doc46140-1|不可否认,2012款奥迪a6的外形得到了全新a7以及a8的真传,但也独具魅力。
-1|0|0|doc45562-1|audia7#车身线条优美,仪表盘有海量的行车信息,波箱顺畅,后排空间出奇的好
-1|0|0|doc47526-2-1|官车,a6l,正处以上~买奥迪的人可以列出非常多奥迪的优点
-1|0|0|doc44868-1|大众这个国际接轨政策,赢得了n多中国人的心
-1|0|0|doc30106-1|本田在近日正式宣布迷你小型车nbox+上市，这一款迷你方块小车比其同家族的nboxtall多了更具功能性的置物空间，具备了一项称为“连结桥”的新功能，车主可借由此装置轻松地将大型的物品轻松地搬到车上,不使用的时候,可完全收至车厢内....
-1|0|0|doc45016-1|丽丽最喜欢宝马,现在开的是奥迪我就是开“最忠诚的”欧宝,也有28%的中奖率呀
-1|0|0|doc47151-1|途锐的前脸的确保留了大众汽车的造型风格,斯文、均衡、平淡,其操控的越野性比奥迪q5更加的霸气与舒服,推进了豪华车领域的步伐,参考价:70~109.34万,加油,努力,我喜欢。
-1|0|0|doc47366-3-1|jaguarxj6l皇家加长版英伦皇室成员和多任首相钦点的“御用座驾”
-1|0|0|doc47366-3-2|奔驰s600实力人士的最爱之一,传统的稳重、豪华、大气
-1|0|0|doc47146-2|说到点上了,其实就是这两点,马力和后排空间,捷豹品牌内涵和工业设计结对一流
-1|0|0|doc47207-1|还是r8好了,多端几年盘子应该买的起它的轮胎了
-1|0|0|doc47428-1|霸气,是喜欢audi呀靠第一眼就爱上了!!!
-1|0|0|doc45115-1|我爱r8,我要试驾一年!
-1|0|0|doc46148-1|我是双鱼,我爱奥迪
-1|0|0|doc46808-1|一直以为是孩子虚伪,爱奥迪!
-1|0|0|doc44818-1-1|我最喜欢奔驰
-1|0|0|doc44818-1-2|最爱宝马
-1|0|0|doc44818-1-3|最中意法拉利
-1|0|0|doc44818-1-4|最挂住奥迪
-1|0|0|doc44818-1-5|最想念保时捷,有点花心添,呵呵
-1|0|0|doc47423-1|我爱老豹子和马丁,当然还有大众。
-1|0|0|doc46567-2-1|只爱法拉利,最喜欢法拉利fxx我爱911
-1|0|0|doc46567-2-2|一直钟爱奥迪
-1|0|0|doc44953-2-1|也喜欢奥迪的车,奋斗目标哈哈哈哈……
-1|0|0|doc47711-4|试驾回来,大爱奥迪a1的s-line的方向盘和s-line的座椅,咋摸咋舒服,咋坐咋得劲!
-1|0|0|doc48141-3|你看,新的奥迪前灯及车前面版,让人爱不释手
-1|0|0|doc45460-1-1|奥迪有我最喜欢的外观设计
-1|0|0|doc45460-1-2|宝马有我最喜欢的驾驶感受
-1|0|0|doc45460-1-3|奔驰有我最崇尚的品牌价值
-1|0|0|doc45460-1-4|保时捷有我最向往的运动时尚
-1|0|0|doc45460-1-5|法拉利有我最尊敬的神秘莫测
-1|0|0|doc45460-1-6|兰博基尼有我最爱慕的狂放不羁
-1|0|0|doc46873-1-1|多年前爱上红色思域
-1|0|0|doc46873-1-2|大气蒙迪欧,权衡再三收了福克斯
-1|0|0|doc46873-1-3|一晃四年了,年纪越长越喜欢白色奥迪a8,每每遇见都垂涎欲滴
-1|0|0|doc47138-4|奥迪tt#作为巴萨的合作伙伴,喜欢巴萨的我自然爱屋及乌。
-1|0|0|doc29886-3|nvh非常好,高速行驶也很安静,车内轻声讲话也不受影响.
-1|0|0|doc47634-3|不过最喜欢的还是途锐啊,坐上去感觉真霸气,关键是安全啊,有了儿子后,我就想买个安全的车啊!
-1|0|0|doc47474-1|autosports先锋试驾#作为奥迪a4l生命周期中最重要、最全面的一次改款,共有多达四十余项全新设计、改进、优化和装备升级,众多领先驾驶辅助装备与大量豪华配置使驾乘更显尊贵、智能和安全,诱惑多多
-1|0|0|doc48469-1|科技让驾驶更安全,生活更轻松。
-1|0|0|doc47579-1|奥迪q5作为一款全用途、全路况车型,标配的山路下坡辅助系统可以在30公里时速情况的下坡过程中,自动保持预先设定的速度,不论是山路陡坡还是地下车库,都能自动调整匀速下坡,让驾驶更加安全
-1|0|0|14574-44456|我感觉到未来的三五年，十几年甚至于二三十年，整个汽车的技术的发展基本上是朝着更加安全，节能，环保和舒适这样四个特征的方向去发展。
-1|0|0|doc48486-1|很想买呢,就是不知道这个的具体介绍啊,在啊能找到呢新奥迪a4l将通过对外观、内饰、动力、装备等全面升级,为驾驶者带来更加安全、舒适、可靠的驾乘感受。
-1|0|0|doc48361-2|车型导购#安全舒适动力强悍体验奥迪a6l3.0t无穷乐趣,奥迪a6l多年以来给人以低调、沉稳、内敛的印象,这种印象多数来自外观。
-1|0|0|doc47505-2|特别是x3的3.0t,那个推背感,空间,特别是平视显示功能,嗷嗷的
-1|0|0|doc48356-1|军人开着军车,挂着红字当头的牌照,行驶在马路上,不是奥迪q7就是宝马奔驰,总给人一种很霸道的感觉
-1|0|0|9314-28557|霸气的gtr帅气的r8加上福特野马可惜电脑玩不到
-1|0|0|doc46090-1|奥迪s5_3.0t,300的表头,霸气有木有
-1|0|0|doc48205-1|奥迪a6l的led灯组霸气十足飞翼造型的led灯组霸气十足,已经成为奥迪家族最为显著的设计标识,让你的爱车在夜晚成为最独特亮丽的风景。
-1|0|0|doc48296-1|体现出了你白和美,奥迪体现了富,9220体现了霸气
-1|0|0|doc48238-1|a7看上去蛮不错的,和a8一样的霸气!
-1|0|0|doc46630-1|沃-哈尔滨#:gmc的情趣绝不是什么个性和可爱,更多的是与生俱来的霸气,虽不能算绝对的豪华品牌,但是强大的气场足够吸引众人的视线了
-1|0|0|doc46051-1|h7很霸气,我很喜欢。
-1|0|0|doc46595-1|wa,这辆又霸气又靓女生特别定制版本,粉色奥迪r8
-1|0|0|doc46777-2|特别霸气~~开玩笑说等老板换宝马7,把他的奥迪卖给我
-1|0|0|doc47388-1|奥迪太霸气了,是因为里面的太难画么?
-1|0|0|doc48332-1|翼笑了之#老家邻居王二嘎新买了部奥迪全新敞篷车,肿么样,霸气吧!
-1|0|0|doc48416-1|喜欢奥迪的霸气,这款车设计者好细心哇……
-1|0|0|doc48088-2|奥迪a1以小见大,霸气外漏
-1|0|0|doc46849-2|奥迪车友会指定装饰店奥迪a4粘后尾灯膜,深邃中透着霸气!
-1|0|0|doc48322-1|全新奥迪a6l上市#炫动全场,霸气啊!
-1|0|0|doc46080-1|奥迪a7,相当霸气,自从在香港看到别人开过一次就爱上了!
-1|0|0|doc46505-1|今天见了台奥迪a8l,太特么帅了,太特么霸气了,尤其是安了个wj开头的红白相间的车牌
-1|0|0|doc47008-1|戒不掉的奥迪a8l,戒不掉的黑哑光,霸气外漏哦!
-1|0|0|doc47809-1|下班回家路上与奥迪a8lw12,6.0同行,真是霸气侧漏啊
-1|0|0|doc47283-1|这个你喜欢不奥迪a9让一切成为可能,霸气了~!
-1|0|0|doc47718-1|霸气~锦华路四段看到开路虎和奥迪q5的摆摊,霸气全方位漏
-1|0|0|doc46737-1|奥迪q5、q7都好有霸气阿,女人开一定帅惨了!!!
-1|0|0|doc46264-1|我终于亲眼见证了一个传说:三个和尚开着奥迪q7来买西瓜,霸气!
-1|0|0|doc46352-2|霸气依旧外露深度测试2011款奥迪q7★测试]2011款奥迪q7,这是一款我绝对买不起,却又与我有着不解之缘的车型。
-1|0|0|doc46256-1|当真实见到兰博基尼和奥迪r8时,才会真的感觉到它们的霸气!
-1|0|0|doc46785-2|#奥迪跑车#蓝色#奥迪r8#上挑的前大灯配以下则宽大的进气口尤其霸气,使人有种窥探远方感觉
-1|0|0|doc48414-1|cool#奥迪跑车#蓝色#奥迪r8#上挑的前大灯配以下则宽大的进气口尤其霸气,使人有种窥探远方感觉
-1|0|0|doc46831-1|奥迪r8dragonage,龙年必须霸气!
-1|0|0|doc46855-1|龙腾世纪啊啊啊啊啊啊啊啊//[转]龙年了,必须上龙图啊,春节特别奉送,奥迪r8dragonage,龙年必须霸气!
-1|0|0|doc47597-1|霸气啊整车看起来好似一面镜子,银装素裹的奥迪r8v10spyder驾到(from
-1|0|0|doc46945-1|奥迪s5哑光涂装,霸气!
-1|0|0|doc46143-1|来茂名这么久,昨晚终于看到个好车,奥迪s8,军a,霸气啊
-1|0|0|doc47402-1|大家出出主意,我比较喜欢奥迪车,尤其感觉奥迪旗下的双钻品牌不错霸气又宽敞马力十足大家觉得怎么样?
-1|0|0|doc46692-1|老家邻居王二嘎新买了部奥迪全新敞篷车,肿么样,霸气吧!
-1|0|0|doc47478-2|全新大切诺基,看着都流口水,排队坐了一下,好霸气
-1|0|0|doc48112-1|大众真是强悍,光是奥迪展台就占了半个展馆,超大的led显示屏反复播放着奥迪的广告,感觉大众才是上海车展的东道主,那股霸气真是气场够强的。
-1|0|0|doc46121-1-1|悍马有点霸气啊
-1|0|0|doc48462-1|奥迪双钻新款雷速登系列名车汇聚:今天要介绍的第四款就是霸气的兰博基尼--第六元素,这可是跑车中的典范哦,超酷超炫~~
-1|0|0|doc47539-1|后来见了路虎,我喜欢路虎的霸气;
-1|0|0|doc47791-1|尤其是路虎,各种霸气
-1|0|0|doc47241-1-2|新a8l才叫霸气,特别是轮胎
-1|0|0|doc47454-1|酷酷的我喜欢,各个方面都很吸引我优雅迷人的车身线条,经典的轿车轮廓,这就是霸气的新奥迪a4l。
-1|0|0|doc48131-1|新奥迪a6l,霸气登场!
-1|0|0|doc47854-1|西溪湿地路口惊遇新奥迪a8w12,各种霸气各种奢华!
-1|0|0|doc46492-1|太霸气了八,一汽奥迪竟然请来了李宗盛!
-1|0|0|doc46125-1|敞篷宝马打头阵,过了一哈在角落我又发现了一辆低调的大黄蜂,第一次见,轮胎上面还有变形金刚的标志,霸气!
-1|0|0|doc47417-1|老家邻居王二嘎新买了部奥迪全新敞篷,肿么样,霸气吧!
-1|0|0|doc47159-1|车队,就是帅,霸气啊#奥迪q5五岳之旅#穿越在齐鲁文化大地。
-1|0|0|doc47765-1|十分霸气,想不到以线条美为主的奥迪也设计霸气车款!
-1|0|0|doc47800-1|奥迪a1的车头设计你一定不会觉得陌生,它延续了家族设计特征,夸张的大嘴凶狠的眼神显得霸气十足
-1|0|0|doc46307-1|s版的整车动感设计完全证明这款车型的霸气身份,各种非常给力~s-觉得你要发力了!
-1|0|0|doc48271-1|360敞篷,真皮座椅前置轮胎使用高级别防滑胎,超长轴距,超大后备箱空间,跳跃式后视镜视野范围非常广阔,飞机都能看的一清二楚,独立式高光大灯霸气至极,前后分离式独立悬架,钢板减震,体现出奥迪公司用料非常老道,舍得,手捏式助力转向器,非常人性化,超高轮拱,全地形,越野性能极为碉堡,
-1|0|0|doc47034-2|奥迪a7太赞了,那个超大后备箱霸气!
-1|0|0|doc47788-1|看到一辆奥迪a8l,w12的,军牌“京v03319”,霸气十足。
-1|0|0|doc46445-4|车身轴承足够长,依旧奥迪那张霸气的脸
-1|0|0|doc46316-2|觉得这车写着我的名字,银色的车身,霸气的轮胎
-1|0|0|doc46895-1|静态体验了一下标致508/2.3旗舰版,那个内饰霸气得简直跟奥迪a6有一拼
-1|0|0|doc29051-2|实力至尊的皇冠,从外部轮廓细致到内饰,都是霸气外漏,绝对是您购车的首选!
-1|0|0|doc46579-2|我最喜欢的一款车就是a6le-tron,尤其是那霸气的前大灯和帅气的轮毂!
-1|0|0|doc47293-1|午安~红色的奥迪a3,霸气的前脸,流线造型,新一代a3太炫了!
-1|0|0|doc46324-1|红色的奥迪a3,霸气的前脸,流线造型,新一代a3太炫了!
-1|0|0|doc46999-1|太帅了红色的奥迪a3,霸气的前脸,流线造型,新一代a3太炫了!
-1|0|0|doc47818-1|一望便知系出奥迪rs家族的霸气前脸,包括带倒角的奥迪一体式进气格栅个性十足
-1|0|0|doc46905-1|下面是全新的奥迪rs5赛车前脸预告图,猛兽啊,前脸依旧霸气!
-1|0|0|doc46178-1|好霸气的前脸,非常好看的奥迪s5,中网改得非常独特!
-1|0|0|doc47173-2|一直很欣赏奥迪的设计,霸气!
-1|0|0|doc46050-1|2013款奥迪rs5,更霸气的外观,搭载更强劲的v8引擎,剑指m3c63引擎参数:4.2l/450-hp/317-lb-ftdohc32气门v8
-1|0|0|doc47566-1|南菱奥迪车型展示#之a5cabriolet2.0tsi,这是我最喜欢的一款车型了,霸气的敞篷外观,独特别致的两侧车玻璃……
-1|0|0|doc46352-1|q7这款车自从上市以来,它霸气的外观就给人们留下了深深地印象
-1|0|0|doc46691-1|外观上,奥迪a8lw12旗舰车型的中网足够霸气,“w12”的字样更是身份的象征,而意味着3倍以上车型差价的外观辨识设计,使得3.0tfsi车头太像a4l的感观再也不会出现在w12车型身上
-1|0|0|doc46763-1|区县巡展第二季#奥迪q7亲临现场,最大最豪华型suv车型,外观霸气定位高端!
-1|0|0|doc48232-1|jedesign针对奥迪q7s-line车型发布了最新宽体改装套件,使外观看上去更加霸气
-1|0|0|doc47590-2|我就是喜欢奥迪的r8,外观蛮霸气的!
-1|0|0|doc47239-1|大舅已经买了辆比亚迪的suv,外观还算霸气
-1|0|0|doc47615-1|奥迪r8的外露引擎好霸气,我滴个神啊,开眼了
-1|0|0|doc46253-2-1|豪华紧凑suv小钢炮试驾奥迪q32.0tfsi
-1|0|0|doc46253-2-2|如果说q7是霸气的全尺寸外形与高端占领高地
-1|0|0|doc46253-2-3|q5是漂亮与科技配置占稳脚跟,那q3凭借的是什么呢?
-1|0|0|doc47893-1|奥迪的外形,矫健当中透露出一种霸气与野性,但同时却又不乏庄重与高雅
-1|0|0|doc46900-2|特别做足了功课来咯奥迪q5有着内敛的外形,虽然相比新a4l或是奥迪a6l来说这台q5仍然足够霸气
-1|0|0|doc47913-2|道选是q7(舒适性及大空间)然后是q5,另外q7外型比x5霸气!
-1|0|0|doc47182-1|600匹柴油怪兽fostlaq7v12tdi-德国fostla改装厂为奥迪q7v12tdi打造了全新的外观与动力升级套件,让这辆大排量柴油suv拥有更霸气的外型与更暴力的马力输出。
-1|0|0|doc47189-1|超霸气,有木有啊奥迪r8v10霸气宣传片
-1|0|0|doc47139-1|看到过好几辆摸上去的感觉真赞~~奥迪s5哑光涂装,霸气!
-1|0|0|doc47833-2|奥迪a6l在外形方面的改动最大,它使用地是奥迪全新的家族式前脸,六角形的大嘴式进气格栅变得略带棱角,鹰眼大灯加入了led灯组,造型霸气犀利
-1|0|0|doc46955-2|别搞奥迪了,搞这个正面确实很霸气
-1|0|0|doc46362-1|奥迪的新款a6很有霸气,今天的礼服也是为此款车设计的,香槟金色好华丽啊
-1|0|0|doc46289-1|哎,回来的最大感受就是青岛的私家车真是越来越多了,我家楼下这条马路以前下班这个点也没这么多车,而且好车也更多了,今天第一次看见传说中的最新款奥迪a8l,真霸气座椅带有自动按摩功能
-1|0|0|doc46781-2|我爱奥迪,爱q7,外形霸气,又不张扬
-1|0|0|doc47974-1|真想拥有一辆奥迪,黑色的,加长的,霸气、帅气!!!
-1|0|0|doc47912-1|隐藏在梦幻中的奥迪a8l,依然无法阻挡他的霸气侧漏。
-1|0|0|doc46100-1|这次它们搭上了改装的哑光灰奥迪r8v8,霸气侧漏了!
-1|0|0|doc46047-2|拖拉机,霸气测漏啊/
-1|0|0|doc46823-1|从效果图上看,allroad依然延续了a6旅行版的整体设计思路,但是在车身设计上更加霸气而厚重,黑色的前前保险杠以及轮毂罩则更加适合复杂路况使用。
-1|0|0|doc46339-2|飞翼造型的led灯组霸气十足,已经成为奥迪家族最为显著的设计标识,让你的爱车在夜晚成为最独特亮丽的风景。
-1|0|0|doc45412-1|是啊农村这些当然是没有的了,每次看到宝马我都会驻足欣赏一番尤其是那些跑车z4还是比较喜欢的还有像7系看着霸气十足x5x6也都很喜欢#bmw使我爱上了汽车#
-1|0|0|doc47594-2|这款最新的奥迪五门豪华轿跑车长4.97米、轴距2.91米、宽1.91米,但高仅为1.42米DD俨然是一名蓄势待发的运动健将,驰骋在公路上霸气十足
-1|0|0|doc48275-1|奥迪a1,小霸王,霸气十足;
-1|0|0|doc46592-1|奥迪q7,v12,tdi柴油版,霸气十足……
-1|0|0|doc48261-1|超长礼宾版奥迪q7霸气十足,移动的酒吧
-1|0|0|doc46502-1|奥迪r8v10改装限量版提车实拍,霸气十足!
-1|0|0|doc46598-2|当奥迪a1的设计任务开始之时,奥迪对这款车的要求看似简单却暗含深刻的哲学思考:要设计一款奥迪的小型车,但它要以霸气十足的气势,精雕细琢的设计风格和独一无二的特色来表明自己的“大”
-1|0|0|doc45202-2|品鉴全新阵容#a3概念车,时尚的红色+霸气十足的前脸设计+动感十足的外观+quattro全轮驱动系统,太赞了!
