1|2.02E+13|284|1548|新车开了几天啦，觉得后视镜好像不舒服呢，特别是左后视镜范围小，好像有车过来总看不到，大家有这个感觉吗，都是怎么解决的呢,,,,,,,,,,,,,,,,,,,,,,,,,,,,,,,,,,,,,,,,,,,,,,,,,,,,,,,,,,,
1|2.02E+13|296|1662|但是中网的变化似乎不如老款好看，前大灯组合也没有改新,,,,,,,,,,,,,,,,,,,,,,,,,,,,,,,,,,,,,,,,,,,,,,,,,,,,,,,,,,,
1|2.02E+13|326|1784|图胜跑四万多公里出了两个问题....轮胎全换了.方向噪音...经沈阳路鑫店检查方向机损坏...质量太差..请车友慎购..本人悔买此车!!!!!,,,,,,,,,,,,,,,,,,,,,,,,,,,,,,,,,,,,,,,,,,,,,,,,,,,,,,,,,,,
1|2.02E+13|341|1809|车友“很皇很冠很皇冠”在回帖中称：感觉没有12代的经典与大气咯,,,,,,,,,,,,,,,,,,,,,,,,,,,,,,,,,,,,,,,,,,,,,,,,,,,,,,,,,,,
1|2.02E+13|341|1814|车友“我为车狂”在回帖中道出了大部分车友对13代的感受：要运动不运动，要大气不大气，要稳重更不稳重,,,,,,,,,,,,,,,,,,,,,,,,,,,,,,,,,,,,,,,,,,,,,,,,,,,,,,,,,,,
1|2.02E+13|343|1819|提车快1个月,油离配合渐渐的熟悉起来,基本不在熄火了,可是中间犯了好几次错,一次是没放下手刹跑了2公里才发现,还有2次是减档的时候从5挡一下给挂到1挡了,车猛的顿了一下又走了,还有一次是升挡的时候本来是要2档升3挡的,却给一下给从2档升到5档了,车一下就给熄火了,吓的我一身汗,还有好几次挂倒档的时候没挂上,车发出好象齿轮碰撞的声音,不知道这样会不会对车有什么大的伤害啊,我该采取些什么补救的措施吗?,,,,,,,,,,,,,,,,,,,,,,,,,,,,,,,,,,,,,,,,,,,,,
1|2.02E+13|359|1916|刚买的DD车,USB存了好多歌曲,连接后却读不出来不知道是什么原因,有知道的大虾请告诉我一下,谢谢啦,,,,,,,,,,,,,,,,,,,,,,,,,,,,,,,,,,,,,,,,,,,,,,,,,,,,,,,
1|2.02E+13|364|1925|我的是Q3标准版的，都半年多，刹车有个问题不知道大家是否也有类似情况在急刹时感觉踩到刹车又踩到“树枝”似的，不知怎么回事，后来发现在路况不平急踩刹车都有这感觉，还好有刹住，不然可以惨了我想应该不是我车问题，大家也应该有，有哪位能处理这类问题发表一下，谢谢啊,,,,,,,,,,,,,,,,,,,,,,,,,,,,,,,,,,,,,,,,,,,,,,,,,,,,,,,,,,,
1|2.02E+13|398|2044|今天发现响声增大了，源头较为容易找了，就是中控仪表盘上方的黑色塑料边框,,,,,,,,,,,,,,,,,,,,,,,,,,,,,,,,,,,,,,,,,,,,,,,,,,,,,,,,,,,
1|2.02E+13|406|2064|我的发动机有烧机油的现象，7千公里烧1升机油,,,,,,,,,,,,,,,,,,,,,,,,,,,,,,,,,,,,,,,,,,,,,,,,,,,,,,,,,,,
1|2.02E+13|421|2135|发现问题的时候是2挡升3挡的时候动力传输突然迟缓,,,,,,,,,,,,,,,,,,,,,,,,,,,,,,,,,,,,,,,,,,,,,,,,,,,,,,,,,,,
1|2.02E+13|427|2177|我的车已经开了6万多公里了，现在跑起来低速的时候有嘎嘎的声音，不知道那声音是那里发出来的，我自己听听好像是减震和轮胎上的,,,,,,,,,,,,,,,,,,,,,,,,,,,,,,,,,,,,,,,,,,,,,,,,,,,,,,,,,,,
1|2.02E+13|508|2564|小弟的1.3AT小v空调在运行时突然会有一股异味，但是很快就没有了，不知道大哥们有没有类似的情况，正常吗,,,,,,,,,,,,,,,,,,,,,,,,,,,,,,,,,,,,,,,,,,,,,,,,,,,,,,,,,,,
1|2.02E+13|515|2576|说实话，DD的轮胎质量不怎么样，不知道大家看法如何,,,,,,,,,,,,,,,,,,,,,,,,,,,,,,,,,,,,,,,,,,,,,,,,,,,,,,,,,,,
1|2.02E+13|515|2583|动力，不太够，，提速没法跟小车比，所以等首保时改一下，雷神整流器，VSD点火增压器，铱金火花塞都列入我改的清单里了4WD的感觉也不是很明显，但是上下马路牙子，很轻松，这就够了我觉得总之，刨去耗油不说，DD是好车，一部物有所值的好车，嘻嘻,,,,,,,,,,,,,,,,,,,,,,,,,,,,,,,,,,,,,,,,,,,,,,,,,,,,,,,,,,,
1|2.02E+13|520|2607|途安1.8刚一万五千公里，前几天去山东在高速上跑到150以上的时候空调出风就很小了（几乎没有风，非常热）当车速下来以后风量会自动变大，请问有没有人遇到相同的情况,,,,,,,,,,,,,,,,,,,,,,,,,,,,,,,,,,,,,,,,,,,,,,,,,,,,,,,,,,,
1|2.02E+13|523|2628|买丰田本田还真不如买个轿子开,,,,,,,,,,,,,,,,,,,,,,,,,,,,,,,,,,,,,,,,,,,,,,,,,,,,,,,,,,,
1|2.02E+13|525|2635|这几天我的导航显示一直和行驶路线不一致，一直为这事烦恼还以为自己倒霉买的车不好,,,,,,,,,,,,,,,,,,,,,,,,,,,,,,,,,,,,,,,,,,,,,,,,,,,,,,,,,,,
1|2.02E+13|529|2652|就是踩下煞车，然后换到油门却没有推动力，又或者，踩下去到了2000左右转数以前是空转，后面才好像有了档一样才有推动力,,,,,,,,,,,,,,,,,,,,,,,,,,,,,,,,,,,,,,,,,,,,,,,,,,,,,,,,,,,
1|2.02E+13|548|2893|根本没有灯光辅助，这么长和大的车视线不好（在灯光暗的地方，根本就是垃圾，有P用,,,,,,,,,,,,,,,,,,,,,,,,,,,,,,,,,,,,,,,,,,,,,,,,,,,,,,,,,,,
1|2.02E+13|558|2945|"请问我的车在凉车启动的时候,车辆1档行驶踩刹车有很刺耳的声音(就像自行车闸皮摩擦车轱辘的声音""吱.."".声音不算是很大),行驶1公里后/热车之后在踩刹车就没有这样的声音了.凉车挂到当踩刹车就没有这样的声音.(最近发现的.由于上车我就听歌所以一直没有注意..这几天注意到了...郁闷呢..谁有知道的麻烦给个回应谢谢,,,,,,,,,,,,,,,,,,,,,,,,,,,,,,,,,,,,,,,,,,,,,,,,,,,,,,,,,"
1|2.02E+13|560|2947|我在倒车的时候抬刹车总能听见前轮嘎吱嘎吱的响不知道各位大侠的威驰有这样的情况吗,,,,,,,,,,,,,,,,,,,,,,,,,,,,,,,,,,,,,,,,,,,,,,,,,,,,,,,,,,,
1|2.02E+13|568|2989|上周出了几天门，从北京回来的时候，最热的时候，空调没了，不舒服事小，没面子事大呀，这么中意的安安怎么这么不给长脸呀,,,,,,,,,,,,,,,,,,,,,,,,,,,,,,,,,,,,,,,,,,,,,,,,,,,,,,,,,,,
1|2.02E+13|577|3054|1、外扬式后车窗只能开那一条小缝，通风很不爽；2、取消了副驾的折叠杯架，增加了置物箱（我气称垃圾箱，有某JS还特意给我纠正是置物箱不是垃圾箱），令我放超长的材料受限制；3、中排滑椅，就算加钱换成转椅，坐垫也不能折起,,,,,,,,,,,,,,,,,,,,,,,,,,,,,,,,,,,,,,,,,,,,,,,,,,,,,,,,,,,
1|2.02E+13|592|3174|打开发动机舱，发现好像是皮带轮发出的声音，各位有知道是怎么回事的吗,,,,,,,,,,,,,,,,,,,,,,,,,,,,,,,,,,,,,,,,,,,,,,,,,,,,,,,,,,,
1|2.02E+13|604|3245|最近我的大麦油耗有点高啊,,,,,,,,,,,,,,,,,,,,,,,,,,,,,,,,,,,,,,,,,,,,,,,,,,,,,,,,,,,
1|2.02E+13|665|3588|不爽的是才换了半个月的固特异轮胎烧掉了一只，当天还加满了油,,,,,,,,,,,,,,,,,,,,,,,,,,,,,,,,,,,,,,,,,,,,,,,,,,,,,,,,,,,
1|2.02E+13|680|3656|第一天新车提回来，停在车库下车就闻到一股焦糊味，立马跟销售联系，说是新车磨合，刹车片的味道,,,,,,,,,,,,,,,,,,,,,,,,,,,,,,,,,,,,,,,,,,,,,,,,,,,,,,,,,,,
1|2.02E+13|710|3933|装配工艺真的越来越差，有的地方还不如我以前的polo，尤其方向盘下方的那个驾驶员手套箱，做的太差了，还有后排中间的杯架已经坏了，我7月14日的车哦，德国人严谨的作风还有多少时间供国人挥霍啊,,,,,,,,,,,,,,,,,,,,,,,,,,,,,,,,,,,,,,,,,,,,,,,,,,,,,,,,,,,
1|2.02E+13|763|4525|才两个月的新车传动轴断裂销售商和厂商说是传动轴见了水才导致断裂的责任有车主自己承担所以车主不服才找来老黄牛在西二环拉车游行的靠怎么发不了图片呀在这个里面大家可以去看看骏捷FRV俱乐部,,,,,,,,,,,,,,,,,,,,,,,,,,,,,,,,,,,,,,,,,,,,,,,,,,,,,,,,,,,
1|2.02E+13|777|4560|现在的汽车配置越来越多，不过有好多都是浪费的，我觉得皇冠的大灯清洗装置是最浪费的，大家发表一下自己的看法啊,,,,,,,,,,,,,,,,,,,,,,,,,,,,,,,,,,,,,,,,,,,,,,,,,,,,,,,,,,,
1|2.02E+13|850|4901|个人感觉马力不怎么好,,,,,,,,,,,,,,,,,,,,,,,,,,,,,,,,,,,,,,,,,,,,,,,,,,,,,,,,,,,
1|2.02E+13|851|4902|前几天方向机漏油了，买了修理包换了，换好以后，助力泵有点响，到现在，方向一会有，一会没有，高速正常，应该怎么办，,,,,,,,,,,,,,,,,,,,,,,,,,,,,,,,,,,,,,,,,,,,,,,,,,,,,,,,,,,,
1|2.02E+13|876|5054|DD的左后视镜有盲区，基本左边车道的车到了车后面5米左右就看不到了，而且大家是否有同感，就是左边镜子看一会儿会头晕,,,,,,,,,,,,,,,,,,,,,,,,,,,,,,,,,,,,,,,,,,,,,,,,,,,,,,,,,,,
1|2.02E+13|924|5320|DD一年多了，基本都满意，就提一点，大灯的灯光不知各位兄弟有没有注意到，晚上开大灯时，你用下玻璃窗，或踩下刹车就会暗一下，开到就近的3S店查了下，说每个韩现的车都有这样的毛病，停在那的几辆打开来看了下，的确有同样的问题，3S给出答案，大家都有问题就不是问题了,,,,,,,,,,,,,,,,,,,,,,,,,,,,,,,,,,,,,,,,,,,,,,,,,,,,,,,,,,,
1|2.02E+13|947|5446|再说导航：打完球送完同事，去接老婆（老婆在上课），那条路曾走过一次，当时也是胸有成竹，好像是忘了出那个口了，往下开，就给迷路了，转不出去了，当时的心里还是很恐惧的，所谓讲：陌生的世界是恐惧的,,,,,,,,,,,,,,,,,,,,,,,,,,,,,,,,,,,,,,,,,,,,,,,,,,,,,,,,,,,
1|2.02E+13|949|5467|途安和同级别的轿车相比，其内饰确有不足之处,,,,,,,,,,,,,,,,,,,,,,,,,,,,,,,,,,,,,,,,,,,,,,,,,,,,,,,,,,,
1|2.02E+13|985|5635|这车牌质量真差!!!!!!!,,,,,,,,,,,,,,,,,,,,,,,,,,,,,,,,,,,,,,,,,,,,,,,,,,,,,,,,,,,
1|2.02E+13|996|5869|缺点显而易见，车皮太薄，车身轻，上高速没有安全感，120左右经过大车时，车就发飘了，真是紧张，车就像纸一样，左右飘动，这是日本车的通病；漆面太软，经常留下划痕,,,,,,,,,,,,,,,,,,,,,,,,,,,,,,,,,,,,,,,,,,,,,,,,,,,,,,,,,,,
1|2.02E+13|996|5870|整车除了发动机声音小点，路噪，胎噪，风噪都远大于欧美系,,,,,,,,,,,,,,,,,,,,,,,,,,,,,,,,,,,,,,,,,,,,,,,,,,,,,,,,,,,
1|2.02E+13|997|5872|看看人家那曲线，纯粹天然，正宗艾斯，再看看我们芙蓉姐姐所谓的曲线，真可谓天上人间人鬼殊途也转自速腾论坛某大虾之水贴，我估计同样的娱乐贴，在咱们皇冠论坛肯定是不会太多人跟帖的也算是和速腾坛天上人间人鬼殊途了吧,,,,,,,,,,,,,,,,,,,,,,,,,,,,,,,,,,,,,,,,,,,,,,,,,,,,,,,,,,,
1|0|0|doc1088-1|a6不适合女孩子啊！
1|0|0|doc3470-1|作为个车迷看到大众推全新taigun小型suv概念车的消息,真心要吐槽vw,从帕萨特到迈腾,途观和途锐,现如今vw已经懒到如此的丧心病狂的态度就是名字修改了一下途观的字母顺序真恶心这辈子都不要买大众了,就冲你这厂商不真诚的态度,我看你神车的老本还能吃多久,不要什么都往家族式这3个词靠好吗?
1|0|0|doc44353-1|新款的桑塔纳难看死了,我现在才发现桑塔纳生日和我只差了三天再见了,普桑,2000,3000,志俊
1|0|0|doc29147-3|今晚阅读了一篇解读当年在手机领域遥遥领先的诺基亚衰败历程，忽然对丰田品牌产生了强烈危机感。
1|0|0|doc23025-6|索尼就像别克，看起来高档用起来低端。
1|0|0|doc45345-2|非常赞同,不愧是行业网站的领头羊更离谱的是,大多数车操控远远不如宝马的车,舒适性也远远不如宝马,悬挂又硬又颠,方向盘还有巨大的虚位,比如奥迪的大部分同级别车,比如高尔夫gti。
1|0|0|doc30888-1|从一汽、上海大众，福特4s店归来，重新整理了行情和感受，新朗逸首选，新福和新速腾备选，crosspolo空间实在不感恭维，a0级小车还是太mini了，后排空间1米75的个子就触顶了。
1|0|0|doc9636-1|宝马与奥迪的4s店服务相差太远了，杭卅骏宝行真是要好好反思一下，员工素养不是一个级别。
1|0|0|doc589-1|希望4s加强售后服务，让我舒服点儿！
1|0|0|doc14507-1|话说奥迪在这部电影的广告打得真失败，剧中最长的一段飙车戏，居然是一宝马和一路虎，宝马废了后，广告商的q5上镜，q5放在路虎旁边就像姚明旁边站了个郭敬明。。。
1|0|0|doc47734-1|光看前面的,有的真的不知道是什么牌子,宝马返朴归真,诺基亚霸气外漏,奥迪想多了!
1|0|0|doc47694-1|奥迪q5,鸡肋!
1|0|0|doc24853-3|之后的问题真是不断,空调不会冷,大热天开开奥迪还得享受奥拓的待遇手拿扇子一个劲的扇..
1|0|0|doc45500-2|依a8,a6的趋势,奥迪很难引起我的好感,很不喜欢改款后的头灯
1|0|0|doc45495-2|宝马太得瑟而且形象差,奔驰本来就维修换件天价e系渗油没完c系又闹这事,还是老老实实奥迪吧,中庸低调。
1|0|0|doc18092-1|福特e350还是不错，比拿奔驰sprinter来改的强多了，那个又慢避震死硬贼不舒服
1|0|0|doc10766-1|大众汽车是没有诚信且傲慢的企业，这样一个漠视客户，懒惰并只在乎赢利的企业，必将受到市场的惩罚！
1|0|0|doc32419-1|讨厌东风本田！
1|0|0|doc9682-1|我还真不信丰田这么硬气。
1|0|0|doc26036-1|日本把垃圾车买到中国谋财害命：又一起德日对决，奥迪a4完胜丰田佳美！
1|0|0|doc47968-1|在奥迪、宝马、奔驰当道的北京大街上,丰田凯美瑞根本不会被当成是豪华车
1|0|0|doc6813-1|操，让广汽去生产，彻底毁jeep这个牌子啊，看看丰田和本田，没有防撞梁，焊接的车门，这样的jeep，你可以想象吗？
1|0|0|doc13488-1|上坡别跟汉兰达，下坡躲着凯美瑞、、日货啊
1|0|0|doc18700-2|难看的车标和有自燃的习惯，我亲眼所见的就有两辆（科鲁兹和景程），这有一辆上演了……
1|0|0|doc32744-2|留住人才，奇瑞从政策、执行到企业内部与人才的合作氛围，并不突出。
1|0|0|doc15664-1|从斜上方看，奔驰ecoupe这个冒充e级车的款型真是臃肿到看不下去，那个amg包的造型都是神马啊，把自己当九十年代末起亚么…
1|0|0|doc27292-1|新车将与通用的赛欧竞争更低端市场间接降低自己品牌价值
1|0|0|doc24899-2|从我这几年在马路上看到的情况分析，改装（包括贴纸）最多的5座轿车（运营车辆不算）应该是雨燕，几乎没有一部雨燕是干干净净呈现原厂状态的，排名第二位的是三菱的翼神，都把自己当evo。
1|0|0|doc22598-1|活脱脱一个雅尊，我觉得本田这代要继续走下坡路了。。。
1|0|0|doc28618-1|实在不觉这车好看~今天在街上看见了辆灰色的，感觉就像是日军的钢盔和德军的尿壶~~这个价位如果不喜欢日本车的话，还是考虑mini或者雪铁龙的ds系列吧，要不然奔驰的b也可以~
1|0|0|doc46425-1|「别摸我」没事会自燃的,三系尤其,七系也一样,虽然我也很喜欢宝马的型,但安全更重要
1|0|0|doc46475-1|个人喜欢大众cc还有就是奥迪系列让你老爸别买日系的,车轻皮薄不安全。
1|0|0|doc15095-2|保险杠，劣质胎，焊接车门，垃圾悬挂系统，没有刹车优先系统，同德国车形成鲜明对比
1|0|0|doc12960-1|买过之后保养你才会发现，保养和到医院看病是一样，这个搞不搞随便你，搞了肯定好点，但你不搞，出了问题我们不负责任，尼玛，日产的，你还有的良心不。
1|0|0|doc10628-1|大多款不比陆虎便宜啊，有一款的官方报价竟然是388万。
1|0|0|doc48281-1|精致小资/粗狂豪爽奥迪q3对比宝马x1-新华汽车-新华网其实这俩都没什么好比的,豪华谈不上,操纵性又比不上纯种的,实用性更不着边儿
1|0|0|doc46271-3|到说glk,产品力不如x3,也不如奥迪q5
1|0|0|doc12315-1|亲身体会，上海大众无论是产品质量，还是售后服务质量，都比一汽大众差！
1|0|0|doc48060-2|买的时候连车的性能都还没有看
1|0|0|doc13638-1|车问网已经发布《“健康汽车”检测报告》，11款主流车型存在致癌风险。
1|0|0|doc21774-1|现在网易各种窗口广告极其烦人，极其闹心，最可恨的是那个加多宝，明明上面是个叉，点了立马蹦出福特汽车的广告，有你们这么糊弄父母的吗？
1|0|0|doc17510-1|这些导航甚至远远不及10万块国产小车的导航好用。
1|0|0|doc28246-1|起亚k2，倒车镜是手动的，麻痹后排窗居然也是手摇的！！！
1|0|0|doc22147-1|慕尚到手开了总共不到1小时，先说一点不足：倒车雷达pdc和其他欧陆gt一样，只能在倒档的时候才自动开启，蠕行前进时必须手动开启。
1|0|0|doc22804-5|近期豪华品牌接连爆出负面新闻：奔驰电池门、致癌门、发动机异响抛锚；
1|0|0|doc46293-3|大多数60万以下suv动力很差,50万的奥迪q5动力比不上22万的本田雅阁,除了高坐姿和看似“越野”(2驱,120千瓦,自重2吨,承载式结构,你觉得能越野?
1|0|0|doc11798-1|不过大奔动力还不如这别克，所以说，买啥车别买低配。
1|0|0|doc10143-1|起亚车动力真无法与日本人的尼桑车相比，提速还是有着很大的延迟。
1|0|0|doc46337-1|一款排量仅为3.0l的发动机并不足以让全新奥迪a8l完全展现出它的霸气与尊贵,即便其带有增压、直喷等先进技术并已经能够提
1|0|0|doc47755-2|粉色奥迪r8,粉嫩嫩受不了~!!
1|0|0|doc10643-1|就你这服务态度不倒闭是老天瞎了眼！！
1|0|0|doc31098-1|今天去广汽丰田ssss第一店''直接遭到无视''首先我检讨是不是自己衣冠不整''毫不怀疑其服务态度''丝看车伤不起我在:
1|0|0|doc24899-1|马路上乱开的排名第一的当仁不让就是马六，我几乎没看到过一部马六是规规矩矩开车的，排名第二的是各类高档跑车
1|0|0|doc13838-1|草，什么技术感…
1|0|0|doc9867-1|奔驰慢慢跟不上宝马和奥迪的节奏了3.5v6的技术out了
1|0|0|doc47981-1|这个a1现在贵啊,价格和gti相当,性能却输gti
1|0|0|doc31587-2|价格1051，看了配件表，斯博睿才700多，crv800多，思域刚调的价格，无非低端车上大挣保养钱。
1|0|0|doc47898-1|bmw的配置??一直?一直?一直坑爹??比起同价位的奥迪,差的太远了?果然和同排量的7系li同价位
1|0|0|doc32024-1|如果奥迪a5不那么烧机油，如果宝马5系的保养成本不那么高，如果捷报xf空间再大点，如果奔驰e级的屁股不那么翘，如果英菲尼迪不是日本车。。。。
1|0|0|doc32744-1|奇瑞的人才流动太大，销售层面、技术层面无一例外。
1|0|0|doc28441-2|车头丑暴了新揽胜的设计应该还是福特做的延续神行者的福特风格路虎真的全线路狗了
1|0|0|doc12295-5|底盘厚实度差一点，前门板扶手太短，整体舒适性不敌polo。
1|0|0|doc47463-2|只从外观上来说ai远远没有minn看着那么的丰富,也与当初谍照曝光时的照片少了些许凶猛,给人感觉有些q??
1|0|0|doc34918-1|记住千万不要买长车,下坡是个大问题?????!!!
1|0|0|doc11660-1|同为豪华车“bba阵营”，奔驰的销量绝对值和相对增幅，都远远落后于对手。
1|0|0|doc13679-2|丰田混动虽然大举进入中国市场，但其攻势却面临多重现实难题，因核心零部件不国产，加上政府补贴政策迟迟未能出台等因素，导致混动车型售价高企，在华销量计划也未能大幅。
1|0|0|doc44628-2|看到雅力士的销量仅仅1200台/月,感觉丰田在中国的市场的很多做法让人难以理解
1|0|0|doc47847-4|考虑性价比的话,比途观值太多了好么?
1|0|0|doc46707-3|有没有人发现,宝马的宣传广告,不像奥迪那样爱炫,不像奔驰那样装高雅,它往往都不是讲述它的产品特色,而是在宣传它的核心价值、它的宝马文化、它的个性艺术、它的创造理念
1|0|0|doc46498-1|还有不是越贵的车音响就越好、例如:凌志lx570,巡航舰这些都是垃圾。
1|0|0|doc47992-2|数据显示,三大德系豪车品牌奔驰、宝马和奥迪占有中国豪华车市场近九成,而lexus比起他们,差的还是很远
1|0|0|doc48045-1|奥迪sb,加价,等车,烧机油,5000公里保养还好意思叫豪华车
1|0|0|doc16472-1|又是比亚迪电动出租车，技术尚不成熟到底存在多少安全隐患
1|0|0|doc20226-1|因挡风玻璃价格比较昂贵，车主苦不堪言。
1|0|0|doc21348-1|小别克前挡都凹了。
1|0|0|doc9928-1|这是供求关系造成的奥迪4s店的态度都这样傲慢？
1|0|0|doc9992-1|好的品也要配合好的服好的服才得更多的客奥迪4s店的态度都这样傲慢？
1|0|0|doc11035-1|哈哈，服务来说雷克萨斯ok的奥迪4s店的态度都这样傲慢？
1|0|0|doc9245-1|奥迪4s店的态度都这样傲慢？
1|0|0|doc24063-2|发现其实选择很难，铃木太低贱，马达太糙，日产是软蛋，丰田白开水，似乎本田还好一点点。
1|0|0|doc47938-1|说起来就是电子设备问题,于是气囊就成摆设了
1|0|0|doc8496-1|2012款本田cr-v太难看了，那尾部设计真够败笔的。
1|0|0|doc47708-1|奥迪这手儿是败招,不高级
1|0|0|doc18850-2|丰田没路刹不住，本田就怕手指戳，一戳马上一个窝，尼桑铁皮更是薄，开关车门都哆嗦。
1|0|0|doc47938-2|想起一朋友的朋友的新a8,开了1年,转向机坏了~大众奥迪的玩意还指望什么安全,质量都保障不了的东西,有安全可言么
1|0|0|doc11827-1|分享图片三选一，我最喜欢这台红色的雪佛兰，外观大气，空间大,中控台超有fell,我不喜欢丰田卡罗拉，老爸你要相信我的眼光，雪佛兰科鲁慈保值率高啊
1|0|0|doc47827-1|而且奔驰和宝马有点暴发户的样子,还是喜欢奥迪多一些
1|0|0|doc47625-1|什么奔驰宝马悍马在我眼里都是暴发户,我只钟情奥迪cc。
1|0|0|doc9547-2|做不好的日企不要啥都怪政治啊政治的牺牲品，杯具～日系车真是杯具寮~
1|0|0|doc23462-1|后面那个红别克（有点远，没看清）mm貌似没睡醒吧，把前面的雪铁龙给追了，结果冲击力让雪铁龙把前面的路虎（没看太清楚好像是）给追了，结果雪铁龙悲催了，前凸后翘了。
1|0|0|doc9990-1|国产车就是给力，高速，一长安奔奔，追尾丰田凯美瑞，整个后备箱被彻底干翻，这是什么级别的对抗，这是什么力量，看谁还买小日本！
1|0|0|doc44728-1|所以所有2.3,1.3发动机全部溃败,所以4at的标致雪铁龙和福克斯人们会嫌弃,但底盘减配没有人关心
1|0|0|doc16680-3|17万的传祺几乎全方位比不上11万的本田锋范。
1|0|0|doc46159-2|氧传失效要看真真导致失效的原因现在原车的氧传感器质量比较差,也成了易损件!
1|0|0|doc22543-2|低档中噪音比较大.
1|0|0|doc48194-1|整车的噪音还是比较大的
1|0|0|doc11104-2|这4s店也真变态，只能选高配，定车等4个月，还要加价两万，当神车卖啊，严重鄙视！
1|0|0|doc48233-2|凯迪拉克一直处于豪华车品牌中的边缘地位,始终和奥迪差距越来越远
1|0|0|doc14804-7|北汽太丢国产车的脸，上周末跟北奔工厂一小领导吃饭说奔驰国产车别买。
1|0|0|doc27914-2|#车市罗盘#整整花了两天时间，原本想通览大众汽车集团前世今生的各种信息，没想到完了冰山一角。
1|0|0|doc17608-1|开丰田不安全了。
1|0|0|doc47133-1|奥迪不霸气,锐志干得好
1|0|0|doc31587-1|鬼子车后期费用还真不便宜，快赶上宝马了。
1|0|0|doc46437-2|沃尔沃车不吸引人,对安全的品牌塑造也并不成功
1|0|0|doc17105-2|奔驰怎么能够推出这种不成熟的产品？
1|0|0|doc28232-1|你车排放不达标
1|0|0|doc32554-1|尼玛换成雪弗兰以后是每人一辆迈锐宝么,大黄蜂神马的奏别想了,尾气不达标!!!
1|0|0|doc13735-2|以前那别克可是小毛病不断，保养费还死贵，不到2年排气管消音器就坏了，4s店换个1500多元，6年下来换了3个。
1|0|0|doc44889-2|蓝牙耳机好像也不方便,那就买辆带蓝牙的汽车吧
1|0|0|doc10033-1|果断的宝马x1，奥迪a1现有款都是两门的，上下车及其不方便，空间也太小，腿伸不开。
1|0|0|68574-177964|不喜suv,路感差,油耗大,后排空间小,停车不方便
1|0|0|doc47122-1|4、价格不菲。
1|0|0|doc9229-1|每个豪华汽车品牌都会推出相应的自行车，这些豪华品牌汽车推出的自行车主要以山地车为主，并且价格都不菲。
1|0|0|doc14630-3|但在系统实施中发现byd功能与售前顾问的说法严重不符，而且售后顾问也很明确byd就是一个标准软件。
1|0|0|doc11854-1|我跟老爸商量买车的事情，我选了即将发布的encore，别克君越和大众图观，最后我爸还是劝我买图观或凯悦，因为encore的新设计不符合规范，而君越不适合我这个档次的男生
1|0|0|doc14731-1|丰田如此极其不负责任的行为，将直接造成国内的某些人会蒙受严重损失，是要破坏中国内部统一的反日口径。
1|0|0|doc48460-2|怎么有这样不负责任的售后
1|0|0|doc35221-1|这个真的要注意，年终岁末盗窃高发，尤其是本田车系，防盗功能不敢恭维，我是中过招的人啊，伤不起啊。
1|0|0|doc48278-2|漳州奥迪盈众致远的服务态度真的是不敢恭维…
1|0|0|doc45593-2|大众的内饰真的是不敢恭维,包括新帕萨特,做的也不好
1|0|0|doc47831-2|a1的外形确实不敢恭维,不是我喜欢的类型
1|0|0|doc47613-2|刹车踩的猛了就abs,近距离不敢猛刹
1|0|0|doc28417-1|真的吗丰田刹车制动系统不稳定，车身轻，安全性不高，如果出现意外，生命财务很难得到保证。
1|0|0|doc45001-1|果然姑娘都喜欢途观领导最近挺好的吧还是途观吧,cc都说性价比不高,奥迪自己开有点不值当,剩下的不好看
1|0|0|doc48503-1|奥迪不给力啊!
